id,name,club,gender,yob,fit,weight,experience
2,Joe Louis,The Academy Boxing Club,male,2011,yes,38,0
3,Sugar Ray Robinson,Club Boxeo Los Álamos,male,2011,yes,40,1
12,Oscar De La Hoya,The Academy Boxing Club,male,2011,yes,48,1
29,Mickey Walker,The Academy Boxing Club,male,2010,yes,54,0
65,Callum Smith,The Academy Boxing Club,male,2011,yes,63,0
70,Nigel Benn,Flookburgh ABC,male,2010,yes,65,4
71,Chris Eubank,Flookburgh ABC,male,2010,yes,65,2
75,Larry Holmes,Dale youth,male,2010,yes,66,5
123,Pernell Whitaker,DOBLE JAB BOXING CLUB,male,2011,yes,80,0
